{
  "id": "courtyard-hub",
  "name": "Courtyard Hub",
  "version": "0.1.0",
  "category": "Hub",
  "description": "A compact central loop for a town that should feel like a small shared base.",
  "tags": ["hub", "loop", "courtyard", "center", "roundabout", "balanced"],
  "requiredBuildings": [],
  "layout": {
    "themeId": "default",
    "decorations": [
      { "id": "road-1", "itemId": "road-square", "x": 328, "y": 236 },
      { "id": "road-2", "itemId": "road-square", "x": 356, "y": 236 },
      { "id": "road-3", "itemId": "road-square", "x": 384, "y": 236 },
      { "id": "road-4", "itemId": "road-square", "x": 328, "y": 264 },
      { "id": "road-5", "itemId": "road-square", "x": 384, "y": 264 },
      { "id": "road-6", "itemId": "road-square", "x": 328, "y": 292 },
      { "id": "road-7", "itemId": "road-square", "x": 356, "y": 292 },
      { "id": "road-8", "itemId": "road-square", "x": 384, "y": 292 },
      { "id": "planter-1", "itemId": "planter", "x": 356, "y": 264 },
      { "id": "fence-1", "itemId": "fence-horizontal", "x": 328, "y": 320 },
      { "id": "fence-2", "itemId": "fence-horizontal", "x": 384, "y": 320 },
      { "id": "shed-1", "itemId": "shed", "x": 424, "y": 264 }
    ],
    "functional": {}
  }
}
